{
  "gltd": 1,
  "revision": 0,
  "id": "GL-3220-H9H8-S36D-WNP7",
  "name": "GroupLab X6 Labels, C Bull, 100 x 150 mm",
  "description": "One label of a set of 5: six scoring bulls, 2 by 3 on the 25-bull Letter sheets' 38.0 mm grid, 30 in the set, black diamonds standing on a point, 1.25 in point to point, the C bull of the 25-bull Letter sheets. Made for a thermal label printer, and prints on any printer that takes 100 x 150 mm labels. Each label reads itself, and GroupLab pools the set and says which label is still missing.",
  "author": "GroupLab built-in library",
  "licence": "CC0-1.0",
  "created": "2026-10-03",
  "units": "dmm",
  "page": {
    "size": "label-100x150",
    "width": 1000,
    "height": 1500,
    "orientation": "portrait"
  },
  "inks": [
    {
      "key": "black",
      "srgb": "#000000",
      "role": "artwork"
    },
    {
      "key": "paper",
      "srgb": "#FFFFFF",
      "role": "paper"
    },
    {
      "key": "fid",
      "srgb": "#000000",
      "role": "fiducial"
    },
    {
      "key": "code",
      "srgb": "#000000",
      "role": "code"
    },
    {
      "key": "text",
      "srgb": "#000000",
      "role": "text"
    }
  ],
  "ringSets": [
    {
      "key": "std",
      "discs": [
        {
          "diameter": 318,
          "ink": "black",
          "shape": "square",
          "rotation": 45
        },
        {
          "diameter": 92,
          "ink": "paper",
          "shape": "square",
          "rotation": 45
        },
        {
          "diameter": 25,
          "ink": "black"
        }
      ]
    }
  ],
  "bulls": [
    {
      "x": 310,
      "y": 486,
      "ringSet": "std",
      "label": "1",
      "scoring": true
    },
    {
      "x": 690,
      "y": 486,
      "ringSet": "std",
      "label": "2",
      "scoring": true
    },
    {
      "x": 310,
      "y": 866,
      "ringSet": "std",
      "label": "3",
      "scoring": true
    },
    {
      "x": 690,
      "y": 866,
      "ringSet": "std",
      "label": "4",
      "scoring": true
    },
    {
      "x": 310,
      "y": 1246,
      "ringSet": "std",
      "label": "5",
      "scoring": true
    },
    {
      "x": 690,
      "y": 1246,
      "ringSet": "std",
      "label": "6",
      "scoring": true
    }
  ],
  "fiducials": {
    "scheme": "grid-boundary-1",
    "family": "apriltag-36h11",
    "markerSize": 40,
    "quietZone": 10,
    "ink": "fid",
    "markers": [
      {
        "id": 0,
        "x": 120,
        "y": 296
      },
      {
        "id": 1,
        "x": 500,
        "y": 296
      },
      {
        "id": 2,
        "x": 880,
        "y": 296
      },
      {
        "id": 15,
        "x": 120,
        "y": 676
      },
      {
        "id": 16,
        "x": 500,
        "y": 676
      },
      {
        "id": 17,
        "x": 880,
        "y": 676
      },
      {
        "id": 30,
        "x": 120,
        "y": 1056
      },
      {
        "id": 31,
        "x": 500,
        "y": 1056
      },
      {
        "id": 32,
        "x": 880,
        "y": 1056
      },
      {
        "id": 45,
        "x": 120,
        "y": 1436
      },
      {
        "id": 46,
        "x": 500,
        "y": 1436
      },
      {
        "id": 47,
        "x": 880,
        "y": 1436
      }
    ]
  },
  "codes": {
    "count": 1,
    "version": 7,
    "ecLevel": "Q",
    "moduleSize": 4,
    "quietZone": 16,
    "placement": "explicit",
    "humanReadableId": true,
    "positions": [
      {
        "x": 196,
        "y": 140
      }
    ]
  },
  "print": {
    "scaling": "none",
    "minimumDpi": 203,
    "colourMode": "mono",
    "generator": "GroupLab 0.2.0",
    "notes": "Print at 100 percent on a label of this size. Do not use fit to page."
  },
  "tiling": {
    "cols": 5,
    "rows": 1,
    "sheetWidth": 1000,
    "sheetHeight": 1500,
    "overlap": 0
  }
}
