{
  "gltd": 1,
  "revision": 0,
  "id": "GL-M8V4-ZDQR-1Y3G-D6VW",
  "name": "GroupLab 3x3 2 MOA, C Bull, Set of 3 A4 Sheets",
  "description": "One sheet of a set of three, the 2 MOA sheets requested by Unholy: nine scoring 2.00 in bulls a sheet, 27 in the set, 3 by 3 on a 63.4 mm grid, each sheet with a nine-field load block. The bull is twice the 1 MOA sheets' 1.00 in bull: 1.91 MOA at 100 yd and 1.75 MOA at 100 m. Each bull is a black diamond standing on a point, 2.00 in point to point, with a white diamond center and a small dot, the C bull of the aim point test. For load development: each sheet reads itself, and GroupLab pools the set and says which sheet is still missing.",
  "author": "GroupLab built-in library",
  "licence": "CC0-1.0",
  "created": "2026-09-29",
  "units": "dmm",
  "page": {
    "size": "a4",
    "width": 2100,
    "height": 2970,
    "orientation": "portrait"
  },
  "inks": [
    {
      "key": "black",
      "srgb": "#000000",
      "role": "artwork"
    },
    {
      "key": "paper",
      "srgb": "#FFFFFF",
      "role": "paper"
    },
    {
      "key": "fid",
      "srgb": "#000000",
      "role": "fiducial"
    },
    {
      "key": "code",
      "srgb": "#000000",
      "role": "code"
    },
    {
      "key": "text",
      "srgb": "#000000",
      "role": "text"
    }
  ],
  "ringSets": [
    {
      "key": "c",
      "discs": [
        {
          "diameter": 508,
          "ink": "black",
          "shape": "square",
          "rotation": 45
        },
        {
          "diameter": 146,
          "ink": "paper",
          "shape": "square",
          "rotation": 45
        },
        {
          "diameter": 41,
          "ink": "black"
        }
      ]
    }
  ],
  "bulls": [
    {
      "x": 416,
      "y": 826,
      "ringSet": "c",
      "label": "1",
      "scoring": true
    },
    {
      "x": 1050,
      "y": 826,
      "ringSet": "c",
      "label": "2",
      "scoring": true
    },
    {
      "x": 1684,
      "y": 826,
      "ringSet": "c",
      "label": "3",
      "scoring": true
    },
    {
      "x": 416,
      "y": 1460,
      "ringSet": "c",
      "label": "4",
      "scoring": true
    },
    {
      "x": 1050,
      "y": 1460,
      "ringSet": "c",
      "label": "5",
      "scoring": true
    },
    {
      "x": 1684,
      "y": 1460,
      "ringSet": "c",
      "label": "6",
      "scoring": true
    },
    {
      "x": 416,
      "y": 2094,
      "ringSet": "c",
      "label": "7",
      "scoring": true
    },
    {
      "x": 1050,
      "y": 2094,
      "ringSet": "c",
      "label": "8",
      "scoring": true
    },
    {
      "x": 1684,
      "y": 2094,
      "ringSet": "c",
      "label": "9",
      "scoring": true
    }
  ],
  "fiducials": {
    "scheme": "grid-boundary-edge-1",
    "family": "apriltag-36h11",
    "markerSize": 40,
    "quietZone": 10,
    "ink": "fid",
    "markers": [
      {
        "id": 0,
        "x": 99,
        "y": 509
      },
      {
        "id": 1,
        "x": 416,
        "y": 509
      },
      {
        "id": 2,
        "x": 733,
        "y": 509
      },
      {
        "id": 3,
        "x": 1050,
        "y": 509
      },
      {
        "id": 4,
        "x": 1367,
        "y": 509
      },
      {
        "id": 5,
        "x": 1684,
        "y": 509
      },
      {
        "id": 6,
        "x": 2001,
        "y": 509
      },
      {
        "id": 21,
        "x": 99,
        "y": 826
      },
      {
        "id": 22,
        "x": 2001,
        "y": 826
      },
      {
        "id": 27,
        "x": 99,
        "y": 1143
      },
      {
        "id": 28,
        "x": 733,
        "y": 1143
      },
      {
        "id": 29,
        "x": 1367,
        "y": 1143
      },
      {
        "id": 30,
        "x": 2001,
        "y": 1143
      },
      {
        "id": 39,
        "x": 99,
        "y": 1460
      },
      {
        "id": 40,
        "x": 2001,
        "y": 1460
      },
      {
        "id": 45,
        "x": 99,
        "y": 1777
      },
      {
        "id": 46,
        "x": 733,
        "y": 1777
      },
      {
        "id": 47,
        "x": 1367,
        "y": 1777
      },
      {
        "id": 48,
        "x": 2001,
        "y": 1777
      },
      {
        "id": 57,
        "x": 99,
        "y": 2094
      },
      {
        "id": 58,
        "x": 2001,
        "y": 2094
      },
      {
        "id": 63,
        "x": 99,
        "y": 2411
      },
      {
        "id": 64,
        "x": 416,
        "y": 2411
      },
      {
        "id": 65,
        "x": 733,
        "y": 2411
      },
      {
        "id": 66,
        "x": 1050,
        "y": 2411
      },
      {
        "id": 67,
        "x": 1367,
        "y": 2411
      },
      {
        "id": 68,
        "x": 1684,
        "y": 2411
      },
      {
        "id": 69,
        "x": 2001,
        "y": 2411
      }
    ]
  },
  "codes": {
    "count": 2,
    "version": 10,
    "ecLevel": "H",
    "moduleSize": 4,
    "quietZone": 16,
    "placement": "corners-1",
    "humanReadableId": true,
    "positions": [
      {
        "x": 250,
        "y": 250
      },
      {
        "x": 1850,
        "y": 250
      }
    ]
  },
  "print": {
    "scaling": "none",
    "minimumDpi": 300,
    "colourMode": "mono",
    "generator": "GroupLab 0.1.0",
    "notes": "Print at 100 percent. Do not use fit to page."
  },
  "dataBlock": {
    "x": 120,
    "y": 2540,
    "width": 1860,
    "height": 310,
    "layout": "fields-3x3-1",
    "fieldSet": "standard-9",
    "reserve": 280,
    "ink": "black",
    "labelInk": "text",
    "border": 2
  },
  "tiling": {
    "cols": 3,
    "rows": 1,
    "sheetWidth": 2100,
    "sheetHeight": 2970,
    "overlap": 0
  }
}
