{
  "gltd": 1,
  "revision": 0,
  "id": "GL-YCSK-DZZ1-R0VJ-4T5Y",
  "name": "GroupLab 5x5 Load Development, Letter",
  "description": "25 scoring bulls on a 38.0 mm grid with a 3-bull sighter row.",
  "author": "GroupLab built-in library",
  "licence": "CC0-1.0",
  "created": "2026-09-13",
  "units": "dmm",
  "page": {
    "size": "letter",
    "width": 2159,
    "height": 2794,
    "orientation": "portrait"
  },
  "inks": [
    {
      "key": "black",
      "srgb": "#000000",
      "role": "artwork"
    },
    {
      "key": "paper",
      "srgb": "#FFFFFF",
      "role": "paper"
    },
    {
      "key": "fid",
      "srgb": "#000000",
      "role": "fiducial"
    },
    {
      "key": "code",
      "srgb": "#000000",
      "role": "code"
    },
    {
      "key": "text",
      "srgb": "#000000",
      "role": "text"
    }
  ],
  "ringSets": [
    {
      "key": "std",
      "discs": [
        {
          "diameter": 254,
          "ink": "black"
        },
        {
          "diameter": 238,
          "ink": "paper"
        },
        {
          "diameter": 127,
          "ink": "black"
        },
        {
          "diameter": 115,
          "ink": "paper"
        },
        {
          "diameter": 25,
          "ink": "black"
        }
      ]
    }
  ],
  "bulls": [
    {
      "x": 320,
      "y": 539,
      "ringSet": "std",
      "label": "1",
      "scoring": true
    },
    {
      "x": 700,
      "y": 539,
      "ringSet": "std",
      "label": "2",
      "scoring": true
    },
    {
      "x": 1080,
      "y": 539,
      "ringSet": "std",
      "label": "3",
      "scoring": true
    },
    {
      "x": 1460,
      "y": 539,
      "ringSet": "std",
      "label": "4",
      "scoring": true
    },
    {
      "x": 1840,
      "y": 539,
      "ringSet": "std",
      "label": "5",
      "scoring": true
    },
    {
      "x": 320,
      "y": 919,
      "ringSet": "std",
      "label": "6",
      "scoring": true
    },
    {
      "x": 700,
      "y": 919,
      "ringSet": "std",
      "label": "7",
      "scoring": true
    },
    {
      "x": 1080,
      "y": 919,
      "ringSet": "std",
      "label": "8",
      "scoring": true
    },
    {
      "x": 1460,
      "y": 919,
      "ringSet": "std",
      "label": "9",
      "scoring": true
    },
    {
      "x": 1840,
      "y": 919,
      "ringSet": "std",
      "label": "10",
      "scoring": true
    },
    {
      "x": 320,
      "y": 1299,
      "ringSet": "std",
      "label": "11",
      "scoring": true
    },
    {
      "x": 700,
      "y": 1299,
      "ringSet": "std",
      "label": "12",
      "scoring": true
    },
    {
      "x": 1080,
      "y": 1299,
      "ringSet": "std",
      "label": "13",
      "scoring": true
    },
    {
      "x": 1460,
      "y": 1299,
      "ringSet": "std",
      "label": "14",
      "scoring": true
    },
    {
      "x": 1840,
      "y": 1299,
      "ringSet": "std",
      "label": "15",
      "scoring": true
    },
    {
      "x": 320,
      "y": 1679,
      "ringSet": "std",
      "label": "16",
      "scoring": true
    },
    {
      "x": 700,
      "y": 1679,
      "ringSet": "std",
      "label": "17",
      "scoring": true
    },
    {
      "x": 1080,
      "y": 1679,
      "ringSet": "std",
      "label": "18",
      "scoring": true
    },
    {
      "x": 1460,
      "y": 1679,
      "ringSet": "std",
      "label": "19",
      "scoring": true
    },
    {
      "x": 1840,
      "y": 1679,
      "ringSet": "std",
      "label": "20",
      "scoring": true
    },
    {
      "x": 320,
      "y": 2059,
      "ringSet": "std",
      "label": "21",
      "scoring": true
    },
    {
      "x": 700,
      "y": 2059,
      "ringSet": "std",
      "label": "22",
      "scoring": true
    },
    {
      "x": 1080,
      "y": 2059,
      "ringSet": "std",
      "label": "23",
      "scoring": true
    },
    {
      "x": 1460,
      "y": 2059,
      "ringSet": "std",
      "label": "24",
      "scoring": true
    },
    {
      "x": 1840,
      "y": 2059,
      "ringSet": "std",
      "label": "25",
      "scoring": true
    },
    {
      "x": 700,
      "y": 2515,
      "ringSet": "std",
      "label": "S1",
      "scoring": false
    },
    {
      "x": 1080,
      "y": 2515,
      "ringSet": "std",
      "label": "S2",
      "scoring": false
    },
    {
      "x": 1460,
      "y": 2515,
      "ringSet": "std",
      "label": "S3",
      "scoring": false
    }
  ],
  "cells": {
    "mode": "grid",
    "drawn": false,
    "sighterGap": 456,
    "grid": {
      "originX": 130,
      "originY": 349,
      "pitchX": 380,
      "pitchY": 380,
      "cols": 5,
      "rows": 5
    }
  },
  "fiducials": {
    "scheme": "grid-boundary-1",
    "family": "apriltag-36h11",
    "markerSize": 40,
    "quietZone": 10,
    "ink": "fid"
  },
  "codes": {
    "count": 4,
    "version": 10,
    "ecLevel": "H",
    "moduleSize": 4,
    "quietZone": 16,
    "placement": "corners-1",
    "humanReadableId": true,
    "positions": [
      {
        "x": 250,
        "y": 250
      },
      {
        "x": 1909,
        "y": 250
      },
      {
        "x": 250,
        "y": 2544
      },
      {
        "x": 1909,
        "y": 2544
      }
    ]
  },
  "print": {
    "scaling": "none",
    "minimumDpi": 300,
    "colourMode": "mono",
    "generator": "GroupLab 0.1.0",
    "notes": "Print at 100 percent. Do not use fit to page."
  }
}
