{
  "gltd": 1,
  "revision": 0,
  "id": "GL-SEBE-5F06-GVTF-3CZK",
  "name": "GroupLab Marker Module Sweep, 0.8 mm, Letter",
  "description": "GL-CF25-LTR with its fiducial markers printed at a 0.8 mm module: a 6.4 mm marker and a 1.6 mm quiet zone. A measurement sheet for FIDUCIAL-DECISION.md section 10, measurement 2, not a built-in target.",
  "author": "GroupLab measurement sweep",
  "licence": "CC0-1.0",
  "created": "2026-09-13",
  "units": "dmm",
  "page": {
    "size": "letter",
    "width": 2159,
    "height": 2794,
    "orientation": "portrait"
  },
  "inks": [
    {
      "key": "black",
      "srgb": "#000000",
      "role": "artwork"
    },
    {
      "key": "paper",
      "srgb": "#FFFFFF",
      "role": "paper"
    },
    {
      "key": "fid",
      "srgb": "#000000",
      "role": "fiducial"
    },
    {
      "key": "code",
      "srgb": "#000000",
      "role": "code"
    },
    {
      "key": "text",
      "srgb": "#000000",
      "role": "text"
    }
  ],
  "ringSets": [
    {
      "key": "std",
      "discs": [
        {
          "diameter": 254,
          "ink": "black"
        },
        {
          "diameter": 238,
          "ink": "paper"
        },
        {
          "diameter": 127,
          "ink": "black"
        },
        {
          "diameter": 115,
          "ink": "paper"
        },
        {
          "diameter": 25,
          "ink": "black"
        }
      ]
    }
  ],
  "bulls": [
    {
      "x": 320,
      "y": 539,
      "ringSet": "std",
      "label": "1",
      "scoring": true
    },
    {
      "x": 700,
      "y": 539,
      "ringSet": "std",
      "label": "2",
      "scoring": true
    },
    {
      "x": 1080,
      "y": 539,
      "ringSet": "std",
      "label": "3",
      "scoring": true
    },
    {
      "x": 1460,
      "y": 539,
      "ringSet": "std",
      "label": "4",
      "scoring": true
    },
    {
      "x": 1840,
      "y": 539,
      "ringSet": "std",
      "label": "5",
      "scoring": true
    },
    {
      "x": 320,
      "y": 919,
      "ringSet": "std",
      "label": "6",
      "scoring": true
    },
    {
      "x": 700,
      "y": 919,
      "ringSet": "std",
      "label": "7",
      "scoring": true
    },
    {
      "x": 1080,
      "y": 919,
      "ringSet": "std",
      "label": "8",
      "scoring": true
    },
    {
      "x": 1460,
      "y": 919,
      "ringSet": "std",
      "label": "9",
      "scoring": true
    },
    {
      "x": 1840,
      "y": 919,
      "ringSet": "std",
      "label": "10",
      "scoring": true
    },
    {
      "x": 320,
      "y": 1299,
      "ringSet": "std",
      "label": "11",
      "scoring": true
    },
    {
      "x": 700,
      "y": 1299,
      "ringSet": "std",
      "label": "12",
      "scoring": true
    },
    {
      "x": 1080,
      "y": 1299,
      "ringSet": "std",
      "label": "13",
      "scoring": true
    },
    {
      "x": 1460,
      "y": 1299,
      "ringSet": "std",
      "label": "14",
      "scoring": true
    },
    {
      "x": 1840,
      "y": 1299,
      "ringSet": "std",
      "label": "15",
      "scoring": true
    },
    {
      "x": 320,
      "y": 1679,
      "ringSet": "std",
      "label": "16",
      "scoring": true
    },
    {
      "x": 700,
      "y": 1679,
      "ringSet": "std",
      "label": "17",
      "scoring": true
    },
    {
      "x": 1080,
      "y": 1679,
      "ringSet": "std",
      "label": "18",
      "scoring": true
    },
    {
      "x": 1460,
      "y": 1679,
      "ringSet": "std",
      "label": "19",
      "scoring": true
    },
    {
      "x": 1840,
      "y": 1679,
      "ringSet": "std",
      "label": "20",
      "scoring": true
    },
    {
      "x": 320,
      "y": 2059,
      "ringSet": "std",
      "label": "21",
      "scoring": true
    },
    {
      "x": 700,
      "y": 2059,
      "ringSet": "std",
      "label": "22",
      "scoring": true
    },
    {
      "x": 1080,
      "y": 2059,
      "ringSet": "std",
      "label": "23",
      "scoring": true
    },
    {
      "x": 1460,
      "y": 2059,
      "ringSet": "std",
      "label": "24",
      "scoring": true
    },
    {
      "x": 1840,
      "y": 2059,
      "ringSet": "std",
      "label": "25",
      "scoring": true
    },
    {
      "x": 700,
      "y": 2515,
      "ringSet": "std",
      "label": "S1",
      "scoring": false
    },
    {
      "x": 1080,
      "y": 2515,
      "ringSet": "std",
      "label": "S2",
      "scoring": false
    },
    {
      "x": 1460,
      "y": 2515,
      "ringSet": "std",
      "label": "S3",
      "scoring": false
    }
  ],
  "fiducials": {
    "scheme": "grid-boundary-1",
    "family": "apriltag-36h11",
    "markerSize": 64,
    "quietZone": 16,
    "ink": "fid",
    "markers": [
      {
        "id": 0,
        "x": 510,
        "y": 349
      },
      {
        "id": 1,
        "x": 890,
        "y": 349
      },
      {
        "id": 2,
        "x": 1270,
        "y": 349
      },
      {
        "id": 3,
        "x": 1650,
        "y": 349
      },
      {
        "id": 4,
        "x": 130,
        "y": 729
      },
      {
        "id": 5,
        "x": 510,
        "y": 729
      },
      {
        "id": 6,
        "x": 890,
        "y": 729
      },
      {
        "id": 7,
        "x": 1270,
        "y": 729
      },
      {
        "id": 8,
        "x": 1650,
        "y": 729
      },
      {
        "id": 9,
        "x": 2030,
        "y": 729
      },
      {
        "id": 10,
        "x": 130,
        "y": 1109
      },
      {
        "id": 11,
        "x": 510,
        "y": 1109
      },
      {
        "id": 12,
        "x": 890,
        "y": 1109
      },
      {
        "id": 13,
        "x": 1270,
        "y": 1109
      },
      {
        "id": 14,
        "x": 1650,
        "y": 1109
      },
      {
        "id": 15,
        "x": 2030,
        "y": 1109
      },
      {
        "id": 16,
        "x": 130,
        "y": 1489
      },
      {
        "id": 17,
        "x": 510,
        "y": 1489
      },
      {
        "id": 18,
        "x": 890,
        "y": 1489
      },
      {
        "id": 19,
        "x": 1270,
        "y": 1489
      },
      {
        "id": 20,
        "x": 1650,
        "y": 1489
      },
      {
        "id": 21,
        "x": 2030,
        "y": 1489
      },
      {
        "id": 22,
        "x": 130,
        "y": 1869
      },
      {
        "id": 23,
        "x": 510,
        "y": 1869
      },
      {
        "id": 24,
        "x": 890,
        "y": 1869
      },
      {
        "id": 25,
        "x": 1270,
        "y": 1869
      },
      {
        "id": 26,
        "x": 1650,
        "y": 1869
      },
      {
        "id": 27,
        "x": 2030,
        "y": 1869
      },
      {
        "id": 28,
        "x": 130,
        "y": 2249
      },
      {
        "id": 29,
        "x": 510,
        "y": 2249
      },
      {
        "id": 30,
        "x": 890,
        "y": 2249
      },
      {
        "id": 31,
        "x": 1270,
        "y": 2249
      },
      {
        "id": 32,
        "x": 1650,
        "y": 2249
      },
      {
        "id": 33,
        "x": 2030,
        "y": 2249
      }
    ]
  },
  "codes": {
    "count": 4,
    "version": 10,
    "ecLevel": "H",
    "moduleSize": 4,
    "quietZone": 16,
    "placement": "corners-1",
    "humanReadableId": true,
    "positions": [
      {
        "x": 250,
        "y": 250
      },
      {
        "x": 1909,
        "y": 250
      },
      {
        "x": 250,
        "y": 2544
      },
      {
        "x": 1909,
        "y": 2544
      }
    ]
  },
  "print": {
    "scaling": "none",
    "minimumDpi": 300,
    "colourMode": "mono",
    "generator": "GroupLab 0.1.0",
    "notes": "Print at 100 percent. Do not use fit to page."
  }
}
