{
  "gltd": 1,
  "revision": 0,
  "id": "GL-025B-Y7FF-VX15-JKXE",
  "name": "GroupLab 5x5 Large Format, Tabloid",
  "description": "25 scoring bulls on a 50.8 mm grid with a 3-bull sighter row and a nine-field load block.",
  "author": "GroupLab built-in library",
  "licence": "CC0-1.0",
  "created": "2026-09-13",
  "units": "dmm",
  "page": {
    "size": "tabloid",
    "width": 2794,
    "height": 4318,
    "orientation": "portrait"
  },
  "inks": [
    {
      "key": "black",
      "srgb": "#000000",
      "role": "artwork"
    },
    {
      "key": "paper",
      "srgb": "#FFFFFF",
      "role": "paper"
    },
    {
      "key": "fid",
      "srgb": "#000000",
      "role": "fiducial"
    },
    {
      "key": "code",
      "srgb": "#000000",
      "role": "code"
    },
    {
      "key": "text",
      "srgb": "#000000",
      "role": "text"
    }
  ],
  "ringSets": [
    {
      "key": "std",
      "discs": [
        {
          "diameter": 381,
          "ink": "black"
        },
        {
          "diameter": 365,
          "ink": "paper"
        },
        {
          "diameter": 191,
          "ink": "black"
        },
        {
          "diameter": 179,
          "ink": "paper"
        },
        {
          "diameter": 38,
          "ink": "black"
        }
      ]
    }
  ],
  "bulls": [
    {
      "x": 381,
      "y": 814,
      "ringSet": "std",
      "label": "1",
      "scoring": true
    },
    {
      "x": 889,
      "y": 814,
      "ringSet": "std",
      "label": "2",
      "scoring": true
    },
    {
      "x": 1397,
      "y": 814,
      "ringSet": "std",
      "label": "3",
      "scoring": true
    },
    {
      "x": 1905,
      "y": 814,
      "ringSet": "std",
      "label": "4",
      "scoring": true
    },
    {
      "x": 2413,
      "y": 814,
      "ringSet": "std",
      "label": "5",
      "scoring": true
    },
    {
      "x": 381,
      "y": 1322,
      "ringSet": "std",
      "label": "6",
      "scoring": true
    },
    {
      "x": 889,
      "y": 1322,
      "ringSet": "std",
      "label": "7",
      "scoring": true
    },
    {
      "x": 1397,
      "y": 1322,
      "ringSet": "std",
      "label": "8",
      "scoring": true
    },
    {
      "x": 1905,
      "y": 1322,
      "ringSet": "std",
      "label": "9",
      "scoring": true
    },
    {
      "x": 2413,
      "y": 1322,
      "ringSet": "std",
      "label": "10",
      "scoring": true
    },
    {
      "x": 381,
      "y": 1830,
      "ringSet": "std",
      "label": "11",
      "scoring": true
    },
    {
      "x": 889,
      "y": 1830,
      "ringSet": "std",
      "label": "12",
      "scoring": true
    },
    {
      "x": 1397,
      "y": 1830,
      "ringSet": "std",
      "label": "13",
      "scoring": true
    },
    {
      "x": 1905,
      "y": 1830,
      "ringSet": "std",
      "label": "14",
      "scoring": true
    },
    {
      "x": 2413,
      "y": 1830,
      "ringSet": "std",
      "label": "15",
      "scoring": true
    },
    {
      "x": 381,
      "y": 2338,
      "ringSet": "std",
      "label": "16",
      "scoring": true
    },
    {
      "x": 889,
      "y": 2338,
      "ringSet": "std",
      "label": "17",
      "scoring": true
    },
    {
      "x": 1397,
      "y": 2338,
      "ringSet": "std",
      "label": "18",
      "scoring": true
    },
    {
      "x": 1905,
      "y": 2338,
      "ringSet": "std",
      "label": "19",
      "scoring": true
    },
    {
      "x": 2413,
      "y": 2338,
      "ringSet": "std",
      "label": "20",
      "scoring": true
    },
    {
      "x": 381,
      "y": 2846,
      "ringSet": "std",
      "label": "21",
      "scoring": true
    },
    {
      "x": 889,
      "y": 2846,
      "ringSet": "std",
      "label": "22",
      "scoring": true
    },
    {
      "x": 1397,
      "y": 2846,
      "ringSet": "std",
      "label": "23",
      "scoring": true
    },
    {
      "x": 1905,
      "y": 2846,
      "ringSet": "std",
      "label": "24",
      "scoring": true
    },
    {
      "x": 2413,
      "y": 2846,
      "ringSet": "std",
      "label": "25",
      "scoring": true
    },
    {
      "x": 889,
      "y": 3455,
      "ringSet": "std",
      "label": "S1",
      "scoring": false
    },
    {
      "x": 1397,
      "y": 3455,
      "ringSet": "std",
      "label": "S2",
      "scoring": false
    },
    {
      "x": 1905,
      "y": 3455,
      "ringSet": "std",
      "label": "S3",
      "scoring": false
    }
  ],
  "fiducials": {
    "scheme": "grid-boundary-1",
    "family": "apriltag-36h11",
    "markerSize": 40,
    "quietZone": 10,
    "ink": "fid",
    "markers": [
      {
        "id": 0,
        "x": 127,
        "y": 560
      },
      {
        "id": 1,
        "x": 635,
        "y": 560
      },
      {
        "id": 2,
        "x": 1143,
        "y": 560
      },
      {
        "id": 3,
        "x": 1651,
        "y": 560
      },
      {
        "id": 4,
        "x": 2159,
        "y": 560
      },
      {
        "id": 5,
        "x": 2667,
        "y": 560
      },
      {
        "id": 6,
        "x": 127,
        "y": 1068
      },
      {
        "id": 7,
        "x": 635,
        "y": 1068
      },
      {
        "id": 8,
        "x": 1143,
        "y": 1068
      },
      {
        "id": 9,
        "x": 1651,
        "y": 1068
      },
      {
        "id": 10,
        "x": 2159,
        "y": 1068
      },
      {
        "id": 11,
        "x": 2667,
        "y": 1068
      },
      {
        "id": 12,
        "x": 127,
        "y": 1576
      },
      {
        "id": 13,
        "x": 635,
        "y": 1576
      },
      {
        "id": 14,
        "x": 1143,
        "y": 1576
      },
      {
        "id": 15,
        "x": 1651,
        "y": 1576
      },
      {
        "id": 16,
        "x": 2159,
        "y": 1576
      },
      {
        "id": 17,
        "x": 2667,
        "y": 1576
      },
      {
        "id": 18,
        "x": 127,
        "y": 2084
      },
      {
        "id": 19,
        "x": 635,
        "y": 2084
      },
      {
        "id": 20,
        "x": 1143,
        "y": 2084
      },
      {
        "id": 21,
        "x": 1651,
        "y": 2084
      },
      {
        "id": 22,
        "x": 2159,
        "y": 2084
      },
      {
        "id": 23,
        "x": 2667,
        "y": 2084
      },
      {
        "id": 24,
        "x": 127,
        "y": 2592
      },
      {
        "id": 25,
        "x": 635,
        "y": 2592
      },
      {
        "id": 26,
        "x": 1143,
        "y": 2592
      },
      {
        "id": 27,
        "x": 1651,
        "y": 2592
      },
      {
        "id": 28,
        "x": 2159,
        "y": 2592
      },
      {
        "id": 29,
        "x": 2667,
        "y": 2592
      },
      {
        "id": 30,
        "x": 127,
        "y": 3100
      },
      {
        "id": 31,
        "x": 635,
        "y": 3100
      },
      {
        "id": 32,
        "x": 1143,
        "y": 3100
      },
      {
        "id": 33,
        "x": 1651,
        "y": 3100
      },
      {
        "id": 34,
        "x": 2159,
        "y": 3100
      },
      {
        "id": 35,
        "x": 2667,
        "y": 3100
      },
      {
        "id": 36,
        "x": 127,
        "y": 3201
      },
      {
        "id": 37,
        "x": 635,
        "y": 3201
      },
      {
        "id": 38,
        "x": 1143,
        "y": 3201
      },
      {
        "id": 39,
        "x": 1651,
        "y": 3201
      },
      {
        "id": 40,
        "x": 2159,
        "y": 3201
      },
      {
        "id": 41,
        "x": 2667,
        "y": 3201
      },
      {
        "id": 42,
        "x": 635,
        "y": 3709
      },
      {
        "id": 43,
        "x": 1143,
        "y": 3709
      },
      {
        "id": 44,
        "x": 1651,
        "y": 3709
      },
      {
        "id": 45,
        "x": 2159,
        "y": 3709
      }
    ]
  },
  "codes": {
    "count": 4,
    "version": 10,
    "ecLevel": "H",
    "moduleSize": 4,
    "quietZone": 16,
    "placement": "corners-1",
    "humanReadableId": true,
    "positions": [
      {
        "x": 250,
        "y": 250
      },
      {
        "x": 2544,
        "y": 250
      },
      {
        "x": 250,
        "y": 3728
      },
      {
        "x": 2544,
        "y": 3728
      }
    ]
  },
  "print": {
    "scaling": "none",
    "minimumDpi": 300,
    "colourMode": "mono",
    "generator": "GroupLab 0.1.0",
    "notes": "Print at 100 percent. Do not use fit to page."
  },
  "dataBlock": {
    "x": 120,
    "y": 3888,
    "width": 2554,
    "height": 310,
    "layout": "fields-3x3-1",
    "fieldSet": "standard-9",
    "reserve": 280,
    "ink": "black",
    "labelInk": "text",
    "border": 2
  }
}
