{
  "gltd": 1,
  "revision": 0,
  "id": "GL-T808-PVP4-9WKW-N9G6",
  "name": "GroupLab Large Format 1.5 in Bulls, 2x2 A4 Sheets",
  "description": "One sheet of a 2 by 2 set: 8 scoring bulls per sheet, 32 in the set, the 1.5 in bull and 2 in spacing of GL-LR25-A3, which it replaces.",
  "author": "GroupLab built-in library",
  "licence": "CC0-1.0",
  "created": "2026-09-27",
  "units": "dmm",
  "page": {
    "size": "a4",
    "width": 2100,
    "height": 2970,
    "orientation": "portrait"
  },
  "inks": [
    {
      "key": "black",
      "srgb": "#000000",
      "role": "artwork"
    },
    {
      "key": "paper",
      "srgb": "#FFFFFF",
      "role": "paper"
    },
    {
      "key": "fid",
      "srgb": "#000000",
      "role": "fiducial"
    },
    {
      "key": "code",
      "srgb": "#000000",
      "role": "code"
    },
    {
      "key": "text",
      "srgb": "#000000",
      "role": "text"
    }
  ],
  "ringSets": [
    {
      "key": "std",
      "discs": [
        {
          "diameter": 381,
          "ink": "black"
        },
        {
          "diameter": 365,
          "ink": "paper"
        },
        {
          "diameter": 191,
          "ink": "black"
        },
        {
          "diameter": 179,
          "ink": "paper"
        },
        {
          "diameter": 38,
          "ink": "black"
        }
      ]
    }
  ],
  "bulls": [
    {
      "x": 796,
      "y": 723,
      "ringSet": "std",
      "label": "1",
      "scoring": true
    },
    {
      "x": 1304,
      "y": 723,
      "ringSet": "std",
      "label": "2",
      "scoring": true
    },
    {
      "x": 796,
      "y": 1231,
      "ringSet": "std",
      "label": "3",
      "scoring": true
    },
    {
      "x": 1304,
      "y": 1231,
      "ringSet": "std",
      "label": "4",
      "scoring": true
    },
    {
      "x": 796,
      "y": 1739,
      "ringSet": "std",
      "label": "5",
      "scoring": true
    },
    {
      "x": 1304,
      "y": 1739,
      "ringSet": "std",
      "label": "6",
      "scoring": true
    },
    {
      "x": 796,
      "y": 2247,
      "ringSet": "std",
      "label": "7",
      "scoring": true
    },
    {
      "x": 1304,
      "y": 2247,
      "ringSet": "std",
      "label": "8",
      "scoring": true
    }
  ],
  "fiducials": {
    "scheme": "grid-boundary-1",
    "family": "apriltag-36h11",
    "markerSize": 40,
    "quietZone": 10,
    "ink": "fid",
    "markers": [
      {
        "id": 0,
        "x": 542,
        "y": 469
      },
      {
        "id": 1,
        "x": 1050,
        "y": 469
      },
      {
        "id": 2,
        "x": 1558,
        "y": 469
      },
      {
        "id": 6,
        "x": 542,
        "y": 977
      },
      {
        "id": 7,
        "x": 1050,
        "y": 977
      },
      {
        "id": 8,
        "x": 1558,
        "y": 977
      },
      {
        "id": 12,
        "x": 542,
        "y": 1485
      },
      {
        "id": 13,
        "x": 1050,
        "y": 1485
      },
      {
        "id": 14,
        "x": 1558,
        "y": 1485
      },
      {
        "id": 18,
        "x": 542,
        "y": 1993
      },
      {
        "id": 19,
        "x": 1050,
        "y": 1993
      },
      {
        "id": 20,
        "x": 1558,
        "y": 1993
      },
      {
        "id": 24,
        "x": 542,
        "y": 2501
      },
      {
        "id": 25,
        "x": 1050,
        "y": 2501
      },
      {
        "id": 26,
        "x": 1558,
        "y": 2501
      }
    ]
  },
  "codes": {
    "count": 4,
    "version": 10,
    "ecLevel": "H",
    "moduleSize": 4,
    "quietZone": 16,
    "placement": "corners-1",
    "humanReadableId": true,
    "positions": [
      {
        "x": 250,
        "y": 250
      },
      {
        "x": 1850,
        "y": 250
      },
      {
        "x": 250,
        "y": 2720
      },
      {
        "x": 1850,
        "y": 2720
      }
    ]
  },
  "print": {
    "scaling": "none",
    "minimumDpi": 300,
    "colourMode": "mono",
    "generator": "GroupLab 0.1.0",
    "notes": "Print at 100 percent. Do not use fit to page."
  },
  "tiling": {
    "cols": 2,
    "rows": 2,
    "sheetWidth": 2100,
    "sheetHeight": 2970,
    "overlap": 0
  }
}
